,,,"The School of Business and Social Sciences at the Aarhus University is located in Denmark and it was established in 1928. It has 737 academic staff and 16,000 students. Its dean is Thomas Pallesen and its Latin name is ""Universitas Aarhusiensis"". The School is a member of the European University Association."
5,5,,Škola obchodních a sociálních věd na univerzitě v Aarhusu sídlí v Dánsku a byla založena v roce 1928. Má 737 akademických pracovníků a 16 000 studentů. Děkanem je Thomas Pallesen a latinský název je „Universitas Aarhusiensis“. Škola je členem Evropské asociace univerzit.
,,,"The School of Business and Social Sciences at the Aarhus University in Denmark was established in 1928 and is affiliated with the European University Association. Its dean is Thomas Pallesen, it has 16,000 students and 737 employees. Its Latin name is Universitas Aarhusiensis."
5,5,,"Škola obchodních a sociálních věd na Aarhuské univerzitě v Dánsku byla založena v roce 1928 a je přidružena k Evropské univerzitní asociaci. Jejím děkanem je Thomas Pallesen, má 16 000 studentů a 737 zaměstnanců. Její latinský název je Universitas Aarhusiensis."
,,,Khadija Arib is the leader of the House of Representatives in the Netherlands.
,,,Khadija Arib je šéfkou Sněmovny reprezentantů v Nizozemsku.
,,,The leader of the House of Representatives in the Netherlands is Khadija Arib.
,,,Předsedkyní Sněmovny reprezentantů v Nizozemsku je Khadija Arib.
,,,Khadija Arib is a leader in the House of Representatives.
,,,Khadija Arib je lídrem ve Sněmovně reprezentantů.
,,,"Elliot See who was originally from Dallas, US graduated from the University of Texas at Austin. He then went on to become a test pilot and has since passed away."
,,,"Elliot See, který pocházel z Dallasu, absolvoval Texaskou univerzitu v Austinu. Poté se stal zkušebním pilotem a od té doby zemřel."
,,,"Akron, Ohio is located within the United States where English is spoken and Asian Americans are an ethnic group there."
,,,"Akron v Ohiu se nachází ve Spojených státech, kde se mluví anglicky a asijští Američané jsou tam etnickou skupinou."
,,,"The country of Akron, Ohio is in the United States where English is the language and Asian Americans are an ethnic group."
,,,"Země Akron, Ohio je ve Spojených státech, kde angličtina je jazyk a asijské Američané jsou etnickou skupinou."
,,,"Akron, Ohio, is located in the English speaking, United States, where Asian Americans are one of the ethnic groups."
,,,"Akron, Ohio, se nachází v anglicky mluvící, Spojené státy, kde asijští Američané jsou jednou z etnických skupin."
,,,"A Wizard of Mars was written by Diane Duane, and has the ISBN number 978-0-15-204770-2."
,,,Čaroděje z Marsu napsala Diane Duane a má číslo ISBN 978-0-15-204770-2.
,,,A Wizard of Mars by Diane Duane has ISBN number 978-0-15-204770-2.
,,,A Wizard of Mars od Diane Duane má ISBN číslo 978-0-15-204770-2.
,,,"The author Diane Duane wrote the book A wizard of Mars, which can be found under the ISBN ""978-0-15-204770-2""."
,,,"Autorka Diane Duane napsala knihu Čaroděj z Marsu, kterou lze nalézt pod ISBN „978-0-15-204770-2“."
,,,Asam pedas is a dish from Sumatra which is a food found in Malaysia.
,,,"Asam pedas je pokrm ze Sumatry, který se vyskytuje v Malajsii."
,,,Sumatran dish asam pedas is found in Malaysia.
,,,Sumatran dish asam pedas se vyskytuje v Malajsii.
,,,Asam pedas is a dish from Sumatra and is also found in Malaysia.
,,,Asam pedas je pokrm ze Sumatry a vyskytuje se i v Malajsii.
,,,Alfred Moore Scales started his career on 1857-03-04.
,,,Alfred Moore Scales zahájil svou kariéru v letech 1857-03-04.
,,,"Alison O'Donnell, formerly of the Flibbertigibbet band, is associated with Plastik Mak."
,,,"Alison O'Donnell, dříve členka skupiny Flibbertigibbet, je spojována s Plastik Mak."
,,,Alison O'Donnell is associated with Plastik Mak and was a member of the Flibbertigibbet band.
,,,Alison O'Donnell je spojená s Plastik Mak a byla členkou skupiny Flibbertigibbet.
,,,Musician Alison O'Donnell is a member of Flibbertigibbet and associated with Plastik Mak.
,,,Hudebnice Alison O'Donnell je členkou skupiny Flibbertigibbet a spojená s Plastik Mak.
,,,"Abner W. Sibal was born in Ridgewood, Queens and was a member of the U.S. Republican party. He was a member of the Connecticut Senate from the 26th District and his successor was, Marjorie Farmer. Abner W. Sibal died in Alexandria, Virginia."
,,,Abner W. Sibal se narodil v Ridgewoodu v Queensu a byl členem americké republikánské strany. Byl členem senátu Connecticutu z 26. obvodu a jeho nástupkyní byla Marjorie Farmerová. Abner W. Sibal zemřel v Alexandrii ve Virginii.
,,,"Connecticut Senate's 26th District Republican member Abner W. Sibal was succeeded by Marjorie Farmer. Sibal was born in Ridgewood, Queens and died in Alexandria, Virginia."
,,,Sibal byl nahrazen Marjorie Farmerovou. Sibal se narodil v Ridgewoodu v Queensu a zemřel v Alexandrii ve Virginii.
,,,"AIP Advances (abbreviated to ""AIP Adv."") covers the discipline of physics."
,,,AIP Advances (zkráceně „AIP Adv.“) pokrývá oblast fyziky.
,,,"AIP Advances (abbreviated to ""AIP Adv."") is devoted to the study of physics."
,,,AIP Advances (zkráceně „AIP Adv.“) se věnuje studiu fyziky.
,,,"AIP Advances, abbreviated to AIP Adv., covers the discipline of physics."
,,,"AIP Advances, zkráceně AIP Adv., pokrývá obor fyzika."
,,,Paul Gustavson created The Arrow.
,,,Paul Gustavson vytvořil The Arrow.
,,,"The comic character, The Arrow, was created by Paul Gustavson."
,,,Komiksovou postavu Šíp vytvořil Paul Gustavson.
,,,"The largest city in Hays County, Texas is San Marcos."
,,,Největším městem okresu Hays County ve státě Texas je San Marcos.
,,,"San Marcos is the largest city in Hays County, Texas."
,,,San Marcos je největší město okresu Hays County ve státě Texas.
,,,Akeem Ayers who made his debut for the Tennessee Titans played previously for the Los Angeles Rams who play their home matches at the Los Angeles Memorial Coliseum.
,,,"Akeem Ayers, který debutoval za Tennessee Titans, hrál předtím za Los Angeles Rams, kteří hrají své domácí zápasy na stadionu Los Angeles Memorial Coliseum."
,,,"Akeem Ayers made his debut for the Tennessee Titans and his former team is the Los Angeles Rams, who play their home matches at the Los Angeles Memorial Coliseum."
,,,"Akeem Ayers debutoval za Tennessee Titans a jeho bývalým týmem jsou Los Angeles Rams, kteří hrají své domácí zápasy na stadionu Los Angeles Memorial Coliseum."
,,,"Akeem Ayers made his debut for the Tennessee Titans and later played for the Los Angeles Rams, whose home ground is the Los Angeles Memorial Coliseum."
,,,"Akeem Ayers debutoval za Tennessee Titans a později hrál za Los Angeles Rams, jejichž domovským hřištěm je Los Angeles Memorial Coliseum."
,,,"John Aman, is the alternative name for the comic character, Amazing-Man."
,,,John Aman je alternativní jméno pro komickou postavu Amazing-Man.
,,,The comic book character Amazing-Man's alter ego is John Aman.
,,,Komiksová postava Amazing-Manova alter ega je John Aman.
,,,John Aman is also known as Amazing-Man in the comics genre.
,,,John Aman je také známý jako Amazing-Man v komiksovém žánru.
,,,Aaron Turner performs ambient music. He is associated with the group Greymachine and has played with the band Twilight.
,,,Aaron Turner se věnuje ambientní hudbě. Je spojen se skupinou Greymachine a hrál s kapelou Twilight.
,,,"Musician, Aaron Turner; plays Ambient music, played with the band Twilight and is associated with the group Greymachine."
,,,"Hudebník Aaron Turner; hraje hudbu Ambient, hraje s kapelou Twilight a je spojen se skupinou Greymachine."
,,,Aaron Turner performs ambient music and played with Twilight and Greymachine.
,,,Aaron Turner hraje ambientní hudbu a hrál s Twilight a Greymachine.
,,,Am. J. Math is the abbreviation for the American Journal of Mathematics which was first published in 1878.
,,,"Am. J. Math je zkratka pro American Journal of Mathematics, která byla poprvé zveřejněna v roce 1878."
,,,"The American Journal of Mathematics, abbreviated to Am. J. Math., was first published in 1878."
,,,"The American Journal of Mathematics, zkráceně Am. J. Math., byl poprvé publikován v roce 1878."
,,,The American Journal of Mathematics was first published in 1878 and is also known by the abbreviated title of Am. J. Math.
,,,Americký Journal of Mathematics byl poprvé publikován v roce 1878 a je také známý pod zkráceným názvem Am. J. Math.
,,,"Batagor is found in Indonesia, it is a variation on the dish Siomay/Shumai and includes peanut sauce."
,,,"Batagor se vyskytuje v Indonésii, je variací na pokrm Siomay/Shumai a obsahuje arašídovou omáčku."
,,,"Batagor is a dish found in Indonesia, it includes peanut sauce. Siomay and Shumai are variations of the same dish."
,,,"Batagor je pokrm nalezený v Indonésii, obsahuje arašídovou omáčku. Siomay a Shumai jsou variace stejného pokrmu."
,,,"The Indonesian dish Batagor and the dish Shumai are variations of the dish Siomay, which contains peanut sauce."
,,,"Indonéský pokrm Batagor a pokrm Shumai jsou variacemi pokrmu Siomay, který obsahuje arašídovou omáčku."
,,,"Ann Arbor, Michigan is part of Washtenaw County, United States."
,,,"Ann Arbor je okres v americkém státě Michigan, který je součástí okresu Washtenaw County."
,,,"Ann Arbor is located in Washtenaw County, Michigan in the United States of America."
,,,Ann Arbor se nachází v okrese Washtenaw County ve státě Michigan ve Spojených státech amerických.
,,,"Ann Arbor is part of Washtenaw County, Michigan in the U.S."
,,,Ann Arbor je součástí okresu Washtenaw County ve státě Michigan ve Spojených státech amerických.
,,,Akeem Adams's club is the Trinidad and Tobago national under 17 football team.
,,,Klub Akeema Adamse je národní tým Trinidadu a Tobaga do 17 let.
,,,Akeem Adams played for the Trinidad and Tobago national under-17 football team.
,,,Akeem Adams hrál za národní tým Trinidadu a Tobaga do 17 let.
,,,Akeem Adams once played for the Trinidad and Tobago national under-17 football team.
,,,Akeem Adams hrával za národní tým Trinidadu a Tobaga do 17 let.
,,,"Albany, Georgia is in the United States where people speak English. The U.S. is home to Americans in general and African Americans."
,,,"Albany v Georgii je ve Spojených státech, kde se mluví anglicky. USA jsou domovem Američanů obecně a Afroameričanů."
,,,"Albany, Georgia, is in the United States, where African Americans are one of the ethnic groups. The people of this English speaking country, are known as Americans."
,,,"Albany v Georgii je ve Spojených státech, kde jsou Afroameričané jednou z etnických skupin. Obyvatelé této anglicky mluvící země jsou známí jako Američané."
,,,Americans is the name given to the inhabitants of the United States. This country is where Albany (in Georgia) is situated. It is also the country where African Americans are an ethnic group. They speak English in the U.S.
,,,"Američané je jméno dané obyvatelům Spojených států. Tato země je místo, kde se nachází Albany (v Georgii). Je to také země, kde jsou Afroameričané etnickou skupinou. V USA mluví anglicky."
,,,"The Samuda Brothers built the Alhambra which is powered by a Humphrys, Tennant and Dykes engine who is located is Deptford."
,,,"Bratři Samudové postavili Alhambru, která je poháněna motorem Humphrys, Tennant a Dykes, který se nachází v Deptfordu."
,,,"The Samuda Brothers built the Alhambra which has a Humphrys, Tennant and Dykes power type from Deptford."
,,,"Bratři Samudové postavili Alhambru, která má výkonný typ Humphrys, Tennant a Dykes z Deptfordu."
,,,Andra became active in the year 2000 and was a singer of rhythm and blues music. That music genre and funk music both originated from blues.
,,,Andra se stal aktivním v roce 2000 a byl zpěvákem rhythm and bluesové hudby. Že hudební žánr a funk hudba oba pocházejí z blues.
,,,Andra began her singing career in 2000 and her musical genre is rhythm and blues from which funk is derived. Rhythm and blues oirginated from blues music.
,,,"Andra začala svou pěveckou kariéru v roce 2000 a jejím hudebním žánrem je rhythm and blues, ze kterého je odvozen funk. Rhythm and blues oirginated from blues music."
,,,Andra is a rhythm and blues singer who became active in the year 2000. Rhythm and blues music originated from the blues and Funk is its derivative.
,,,"Andra je rhythm and bluesová zpěvačka, která se stala aktivní v roce 2000. Rhythm and bluesová hudba vznikla z blues a Funk je jeho derivátem."
,,,The 1955 Dodge has a 3-speed automatic transmission.
,,,Dodge z roku 1955 má třístupňovou automatickou převodovku.
,,,The 1955 Dodge uses a 3-speed automatic transmission.
,,,Dodge z roku 1955 používá třístupňovou automatickou převodovku.
,,,The 1955 Dodge possesses a 3-speed automatic transmission.
,,,Dodge z roku 1955 má třístupňovou automatickou převodovku.
,,,"Adam McQuaid, who plays for Boston based, Boston Bruins, draft team was the Columbus Blue Jackets."
,,,"Adam McQuaid, který hraje za Boston založené, Boston Bruins, draftu tým byl Columbus Blue Jackets."
,,,Adam McQuaid whose draft team is the Columbus Blue Jackets plays for the Boston Bruins from Boston.
,,,"Adam McQuaid, jehož draftový tým je Columbus Blue Jackets, hraje za Boston Bruins z Bostonu."
,,,Adam McQuaid's draft team was the Columbus Blue Jackets and he later played for Boston Bruins who are based in Boston.
,,,"Adam McQuaid draftoval tým Columbus Blue Jackets a později hrál za Boston Bruins, kteří sídlí v Bostonu."
,,,The orbital period of 109 Felicitas is 139705000.0.
,,,Oběžná perioda 109 Felicitas je 139705000.0.
,,,109 Felicitas has an orbital period of 139705000.0.
,,,109 Felicitas má oběžnou periodu 139705000.0.
,,,Aleksandr Prudnikov playes for FC Spartak Moscow and FC Terek Grozny. The latter is based in Grozny and the manager is Rashid Rakhimov.
,,,Alexandr Prudnikov hraje za FC Spartak Moskva a FC Těrek Groznyj. Druhý jmenovaný má sídlo v Grozném a manažerem je Rašid Rakhimov.
,,,"Aleksandr Prudnikov, who plays for FC Spartak Moscow, played for FC Terek Grozny. Rashid Rakhimov is the manager of FC Terek Grozny, the ground of which, is located in Grozny."
,,,"Alexandr Prudnikov, který hraje za FC Spartak Moskva, hrál za FC Terek Groznyj. Rašid Rakhimov je manažerem FC Terek Groznyj, jehož hřiště se nachází v Grozném."
,,,"FC Terek Grozny, which has its ground in Grozny, is managed by Rashid Rakhimov. Aleksandr Prudnikov, who played for FC Spartak Moscow, plays for FC Terek Grozny."
,,,"FC Terek Groznyj, který má své působiště v Grozném, řídí Rašid Rakhimov. Alexandr Prudnikov, který hrál za FC Spartak Moskva, hraje za FC Terek Groznyj."
,,,The ALCO RS-3 has a four-stroke engine and was built by the American Locomotive Company.
,,,ALCO RS-3 má čtyřtaktní motor a byl postaven americkou lokomotivní společností.
,,,The American Locomotive Company built the ALCO RS-3 which has a 4-stroke engine.
,,,"Společnost American Locomotive Company postavila stroj ALCO RS-3, který má čtyřtaktní motor."
,,,Dead Man's plack is made of rock and found in England (the capital of which is London) where Cornish is spoken.
,,,"Plak Dead Man je vyroben z kamene a nachází se v Anglii (jejíž hlavní město je Londýn), kde se mluví kornštinou."
,,,"The Dead Man's Plack is a monument made of rock situated in England. The capital of England is London, and Cornish is one of languages spoken in England."
,,,"The Dead Man's Plack je kamenný pomník, který se nachází v Anglii. Hlavním městem Anglie je Londýn a kornština je jedním z jazyků, kterými se v Anglii mluví."
,,,"The Alfa Romeo 164 is considered a mid-size luxury executive car and is also known as the ""Alfa Romeo 168"". The bodystyle of the Alfa Romeo 164 is Sedan and it has a straight four engine."
,,,Alfa Romeo 164 je považována za středně velké luxusní výkonné auto a je také známá jako „Alfa Romeo 168“. Karoserie Alfy Romeo 164 je Sedan a má přímý čtyřmotorový motor.
,,,The Alfa Romeo 164 has a Sedan body style and a straight-four engine. It is considered a mid-size luxury executive car and its alternative name is the Alfa Romeo 168.
,,,Alfa Romeo 164 má karoserii ve stylu Sedan a řadový čtyřválcový motor. Je považována za středně velký luxusní výkonný vůz a její alternativní název je Alfa Romeo 168.
,,,"Ahmet Ertegun, from the United States, plays rhythm and blues. A derivative of this genre is disco."
,,,Ahmet Ertegun ze Spojených států hraje rhythm and blues. Derivací tohoto žánru je disco.
,,,American Ahmet Ertegun plays Rhythm and Blues which helped give rise to Disco.
,,,"Američan Ahmet Ertegun hraje Rhythm and Blues, ze kterého vzešlo Disco."
,,,"The musical genre of american, Ahmet Ertegun, is rhythm and blues, a derivative of which is disco."
,,,"Hudebním žánrem Američana Ahmeta Erteguna je rhythm and blues, jehož derivátem je disco."
,,,"Orange County, is part of the greater Los Angeles area, in California where Anaheim and the United States House of Representatives can be found."
,,,"Orange County je součástí větší oblasti Los Angeles v Kalifornii, kde se nachází Anaheim a Sněmovna reprezentantů Spojených států."
,,,Anaheim in the United States lies within the Greater Los Angeles area of California. It is part of Orange County and led by the United States House of Representatives.
,,,Anaheim ve Spojených státech leží v oblasti Velkého Los Angeles v Kalifornii. Je součástí okresu Orange County a vede ho Sněmovna reprezentantů Spojených států.
,,,Anaheim is located in Orange County which is part of the Greater Los Angeles area of California. The city is led by the United States House of Representatives.
,,,"Anaheim se nachází v okrese Orange County, který je součástí oblasti Greater Los Angeles v Kalifornii. Město vede Sněmovna reprezentantů Spojených států."
,,,Grantville Gazette II is preceded by The Grantville Gazette.
,,,Grantville Gazette II předchází The Grantville Gazette.
,,,The Grantville Gazette preceded The Grantville Gazette II.
,,,Grantville Gazette předcházel The Grantville Gazette II.
,,,Grantville Gazette II was preceded by The Grantville Gazette.
,,,Grantville Gazette II předcházel The Grantville Gazette.
,,,11 Diagonal Street is in South Africa whose capital is Cape Town and Cyril Ramaphosa is one of its leaders. Ethnic groups in South Africa are Coloured people and Asian South Africans.
,,,"11 Diagonal Street je v Jižní Africe, jejímž hlavním městem je Kapské Město a Cyril Ramaphosa je jedním z jejích vůdců. Etnické skupiny v Jižní Africe jsou barevní lidé a asijští Jihoafričané."
,,,"11 Diagonal Street is located in South Africa, where ethnic groups include the Asian South Africans and the Coloured. Cyril Ramaphosa is the leader of South Africa, and its capital is Cape Town."
,,,"11 Diagonal Street se nachází v Jihoafrické republice, kde k etnickým skupinám patří asijští Jihoafričané a barevní. Cyril Ramaphosa je vůdcem Jihoafrické republiky a jejím hlavním městem je Kapské Město."
,,,"Two of the ethnic groups in South Africa, led by Cyril Ramaphosa, are the Asian South Africans and the coloured people. The country is the location of 11 Diagonal Street and has the capital city of Cape Town."
,,,"Dvě z etnických skupin v Jižní Africe, které vede Cyril Ramaphosa, jsou Asijští Jihoafričané a barevní lidé. Země se nachází na 11 Diagonal Street a má hlavní město Kapské Město."
,,,Brooklyn is part of New York City.
,,,Brooklyn je součástí New Yorku.
,,,Brooklyn is a part of New York City.
,,,Brooklyn je součástí New Yorku.
,,,Al Khor Sports Club plays in the Qatar Stars League.
,,,Al Khor Sports Club hraje v Qatar Stars League.
,,,Al-Khor Sports Club's position is in the Qatar Stars League.
,,,Sportovní klub Al-Khor působí v Qatar Stars League.
,,,The ethnic group of Ireland is White people which is where the book A Long Long Way comes from and was followed by The Secret Scripture after being published by Faber and Faber.
,,,"Etnickou skupinou Irska jsou Běloši, odkud pochází kniha Dlouhá dlouhá cesta, po níž následovalo Tajné Písmo poté, co ji vydali Faber a Faber."
,,,"The book The secret Scriptures, published by Faber and Faber, is the follow-up to the novel A Long Long Way which was written in Ireland. One of the ethnic groups of Ireland is White People."
,,,"Kniha Tajné Písmo, kterou vydali Faber a Faber, navazuje na román Dlouhá dlouhá cesta, který byl napsán v Irsku. Jednou z etnických skupin Irska jsou běloši."
,,,"Linebacker Akeem Dent was born in Atlanta, Georgia."
,,,Linebacker Akeem Dent se narodil v Atlantě v Georgii.
,,,"Akeem Dent, who was born in Atlanta, Georgia is a linebacker."
,,,"Akeem Dent, který se narodil v Atlantě, Georgia je linebacker."
,,,"Born in Atlanta, Georgia, Akeem Dent's position is linebacker."
,,,Narodil se v Atlantě v Georgii a jeho trenérem je obránce Akeem Dent.
,,,"Italians are the people who live in Italy, where Italian is the language. Two of the leaders there are Pietro Grasso and Sergio Mattarella. Also in Italy, is the ground of A.S. Gubbio 1910."
,,,"Italové jsou lidé, kteří žijí v Itálii, kde je italština jazykem. Dva z tamních vůdců jsou Pietro Grasso a Sergio Mattarella. Také v Itálii je půda A.S. Gubbia 1910."
,,,"The ground of A.S. Gubbio 1910 is located in Italy, where Italians live and where the language spoken is Italian. Pietro Grasso and Sergio Mattarella are leaders in Italy."
,,,"Půda A.S. Gubbia 1910 se nachází v Itálii, kde žijí Italové a kde se mluví italsky. Pietro Grasso a Sergio Mattarella jsou vůdci v Itálii."
,,,The ground of A.S. Gubbio 1910 is located in Italy where Pietro Grasso and Sergio Mattarella are leaders and the Italian language is spoken. The inhabitants of Italy are knows as Italians.
,,,"Půda A.S. Gubbia 1910 se nachází v Itálii, kde Pietro Grasso a Sergio Mattarella jsou vůdci a mluví se italsky. Obyvatelé Itálie jsou známí jako Italové."
,,,Ayam penyet is a food dish found in Java where the Baduy are an ethnic group.
,,,"Ayam penyet je pokrm, který se nachází na Jávě, kde Baduyové tvoří etnickou skupinu."
,,,Ayam penyet is a food found in Java; the Baduy are one of the ethnic groups found in the country.
,,,Ayam penyet je potravina nacházející se na Jávě; Baduyové jsou jednou z etnických skupin nacházejících se v zemi.
,,,Ayam Penyet is a food found in Java where an ethnic group is Baduy.
,,,"Ayam Penyet je jídlo nalezené na Jávě, kde je etnická skupina Baduy."
,,,1101 Clematis has a mass of 5.7 kgs.
,,,"1101 Clematis má hmotnost 5,7 kg."
,,,1101 Clematis has a mass of 5.7 kilograms.
,,,"1101 Clematis má hmotnost 5,7 kilogramu."
,,,"Alex Tyus plays in the Euroleague for the club, Maccabi Tel Aviv B.C."
,,,Alex Tyus hraje Euroligu za klub Maccabi Tel Aviv B.C.
,,,"Alex Tyus, now in the Euroleague, played for Maccabi Tel Aviv B.C."
,,,"Alex Tyus, nyní v Eurolize, hrál za Maccabi Tel Aviv B.C."
,,,"Alex Tyus, who played for Maccabi Tel Aviv B.C., plays in the Euroleague."
,,,"Alex Tyus, který hrál za Maccabi Tel Aviv B.C., hraje Euroligu."
,,,Jack Kirby is an American.
,,,Jack Kirby je Američan.
,,,Jack Kirby's nationality is American.
,,,Národnost Jacka Kirbyho je americká.
,,,Jack Kirby was an American.
,,,Jack Kirby byl Američan.
,,,"Akeem Ayers, who was born in 1989, made his debut for the Tennessee Titans and has also played for the New England Patriots."
,,,"Akeem Ayers, který se narodil v roce 1989, debutoval za Tennessee Titans a hrál také za New England Patriots."
,,,Akeem Ayers was born in 1989 and made his debut with the Tennessee Titans and has also played for the New England Patriots.
,,,Akeem Ayers se narodil v roce 1989 a debutoval v Tennessee Titans a hrál také za New England Patriots.
,,,"Asam pedas is a food found in Malaysia, of which the capital city is Putrajaya."
,,,"Asam pedas je jídlo, které se nachází v Malajsii, jejímž hlavním městem je Putrajaya."
,,,Putrajaya is the capital of Malaysia where Asam pedas is one of the foods.
,,,"Putrajaya je hlavní město Malajsie, kde je Asam pedas jednou z potravin."
,,,Asam pedas is a food found in Malaysia whose capital is Putrajaya.
,,,"Asam pedas je potravina vyskytující se v Malajsii, jejímž hlavním městem je Putrajaya."
,,,"The AIDAluna has a length of 252000.0 millimetres and a its ship beam length is 32.2. AIDAluna service was started on the 22nd of March, 2009."
,,,"AIDAluna má délku 252000,0 milimetrů a délku lodního nosníku 32,2. Provoz AIDAluny byl zahájen 22. března 2009."
,,,"Started its service on the 22nd March, 2009, the AIDAluna is 252000.0 millimetres long and has a beam of 32.2m."
,,,"Svůj provoz zahájila 22. března 2009, AIDAluna je dlouhá 252000,0 milimetrů a má nosnost 32,2 m."
,,,"The service of the AIDAluna began March 22, 2009. The AIDAluna is 252 m long and its beam is 32.2 m. long."
,,,"Služba AIDAluny začala 22. března 2009. AIDAluna je dlouhá 252 m a její trám je dlouhý 32,2 m."
,,,"Kent (United Kingdom) born Adam Holloway is in the Conservative Party (UK), and is a graduate of Magdalene College, Cambridge."
