,,,Kent (Spojené království) rozený Adam Holloway je členem Konzervativní strany (UK) a je absolventem Magdalene College v Cambridge.
,,,"Magdalene College Cambridge alum and Tory member Adam Holloway, was born in Kent, United Kingdom."
,,,Absolvent Magdalene College Cambridge a člen Tory Adam Holloway se narodil v Kentu ve Spojeném království.
,,,Alex Day performs Synthpop music which is a form of pop music derived from house music.
,,,"Alex Day zpívá hudbu Synthpop, která je formou pop music odvozenou od house music."
,,,"Alex Day uses the Synthpop genre, which gets it stylistic origins from pop music. It is derived from house music."
,,,"Alex Day používá žánr Synthpop, který mu dává stylistický původ z pop music. Je odvozen od house music."
,,,"Alex Day performs Synthpop music, a form of House music, which has its stylistic origins in pop music."
,,,"Alex Day hraje Synthpop music, což je forma House music, která má svůj stylistický původ v pop music."
,,,Joseph Stalin was a commander in World War II.
,,,Josef Stalin byl velitelem ve druhé světové válce.
,,,A commander in World War II was Joseph Stalin.
,,,Velitelem ve druhé světové válce byl Josef Stalin.
,,,"Andrew White, a musician signed to the record label B-Unique Records, plays for the band Kaiser Chiefs and is associated with the musical artist Marry Banilow."
,,,"Andrew White, hudebník, který podepsal smlouvu s nahrávacím vydavatelstvím B-Unique Records, hraje v kapele Kaiser Chiefs a je spojován s hudební umělkyní Marry Banilow."
,,,"Kaiser Chiefs band member, musician Andrew White, is signed to the record label B-Unique Records andis associated with the musical artist, Marry Banilow."
,,,"Člen kapely Kaiser Chiefs, hudebník Andrew White, je podepsán pod nahrávací společností B-Unique Records a je spojen s hudební umělkyní Marry Banilow."
,,,Andrew White is signed with B-Unique Records and is associated with Marry Banilow. and the Kaiser Chiefs.
,,,Andrew White je podepsán s B-Unique Records a je spojován s Marry Banilow. a Kaiser Chiefs.
,,,"With a runway length of 3800 metres, Athens International Airport is in Spata, and serves the city of Athens."
,,,Mezinárodní letiště v Aténách se svou ranvejí o délce 3800 metrů se nachází ve Spatě a obsluhuje město Atény.
,,,Athens International Airport serves Athens but is actually located in Spata. Its runway length is 3800.
,,,"Aténské mezinárodní letiště obsluhuje Atény, ale ve skutečnosti se nachází ve Spatě. Délka jeho dráhy je 3800."
,,,"Athens International Airport located in Spata, serves the city of Athens. Its runway length is 3,800."
,,,"Mezinárodní letiště v Aténách, které se nachází ve Spatě, obsluhuje město Atény. Délka jeho přistávací dráhy je 3 800."
,,,Abradab was born in Poland and one of the country's ethnic groups is Kashubians.
,,,Abradab se narodil v Polsku a jednou z etnických skupin v zemi jsou Kašubové.
,,,The birth place of Abradab is Poland where Kashubians are an ethnic group.
,,,"Rodným místem Abradabu je Polsko, kde jsou Kašubové etnickou skupinou."
,,,Abradab was born in Poland where Kashubians are an ethnic group.
,,,"Abradab se narodil v Polsku, kde jsou Kašubové etnickou skupinou."
,,,"Adolfo Suarez Madrid-Barajas airport, which is operated by ENAIRE, is located at Madrid, Paracuellos de Jarama, San Sebastián de los Reyes and Alcobendas. The airport is 610 metres above sea level, has a runway name of 14R/32L and a length of 3500."
,,,"Letiště Adolfo Suarez Madrid-Barajas, které provozuje společnost ENAIRE, se nachází v Madridu, Paracuellos de Jarama, San Sebastián de los Reyes a Alcobendas. Letiště leží 610 metrů nad mořem, má dráhu s názvem 14R/32L a délku 3500."
,,,"Adolfo Suárez Madrid-Barajas Airport is locaed in Madrid, Paracuellos de Jarama, San Sebastian de los Reyes and Alcobendas. The airport has an elevation 610.0 meters above sea level and operated by ENAIRE. The airport has a runway called 14R/32L and is 3,500 long."
,,,"Letiště Adolfo Suárez Madrid-Barajas je locaed v Madridu, Paracuellos de Jarama, San Sebastian de los Reyes a Alcobendas. Letiště má nadmořskou výšku 610,0 metrů nad mořem a provozuje ho společnost ENAIRE. Letiště má přistávací dráhu 14R/32L a je dlouhé 3500 metrů."
,,,Duncan Rouleau and Steven T. Seagle created Baymax.
,,,Duncan Rouleau a Steven T. Seagle vytvořili Baymax.
,,,Baymax was created by Duncan Rouleau and Steven T. Seagle.
,,,Baymax vytvořili Duncan Rouleau a Steven T.
,,,Baymax was created by both Duncan Rouleau and Steven T. Seagle.
,,,Baymax vytvořili Duncan Rouleau a Steven T.
,,,"Jean-Michel Aulas owns the Olympique Lyonnais FC out of the Parc Olympique Lyonnais stadium, where Aleksandre Gurul is a member. Aleksandre Guruli also played for the FC Dinamo Batumi of which Levan Khomeriki is the manager."
,,,"Jean-Michel Aulas vlastní klub Olympique Lyonnais FC ze stadionu Parc Olympique Lyonnais, jehož členem je Aleksandre Gurul. Aleksandre Guruli hrál také za FC Dinamo Batumi, jehož manažerem je Levan Chomeriki."
,,,"Footballer, Aleksandre Guruli plays for FC Dinamo Batumi whose manager is Levan Khomeriki. He plays also for the Olympique Lyonnais club whose owner is Jean-Michel Aulas and whose home ground is the Parc Olympique Lyonnais."
,,,"Fotbalista Aleksandre Guruli hraje za FC Dinamo Batumi, jehož manažerem je Levan Chomeriki. Hraje také za klub Olympique Lyonnais, jehož majitelem je Jean-Michel Aulas a jehož domovským hřištěm je Parc Olympique Lyonnais."
,,,Aleksandre Guruli played for the Olympique Lyonnais club who are owned by Jean-Michel Aulas and play their home games at the Parc Olympique Lyonnais. He also played for FC Dinamo Batumi who are managed by Levan Khomeriki.
,,,"Aleksandre Guruli hrál za klub Olympique Lyonnais, který vlastní Jean-Michel Aulas a své domácí zápasy hraje v Parc Olympique Lyonnais. Hrál také za FC Dinamo Batumi, které vede Levan Chomeriki."
,,,"Ahmet Ertegun was born 1923, in Washington D.C., the United States and was a Rock and roll performer who had a background as a non performing personnel."
,,,"Ahmet Ertegun se narodil v roce 1923 ve Washingtonu D.C. ve Spojených státech a byl rokenrolovým umělcem, který měl zázemí jako nevýkonný personál."
,,,Ahmet Ertegun was born 1923 and is from the United States. Washington D.C. is the origin of Ahmet Ertegun whohas a background as a non performing personnel. Ahmet Ertegun performs rock and roll music.
,,,"Ahmet Ertegun se narodil v roce 1923 a pochází ze Spojených států. Washington D.C. je původem Ahmeta Erteguna,který má zázemí jako nevýkonný personál. Ahmet Ertegun hraje rock and rollovou hudbu."
,,,Ahmet Ertegun originates from Washington D.C. (United States) and was born 1923. Ahmet Ertegun performs rock and roll music and his background is non performing personnel.
,,,Ahmet Ertegun pochází z Washingtonu D.C. (Spojené státy) a narodil se v roce 1923. Ahmet Ertegun hraje rock and rollovou hudbu a jeho zázemím je nevýkonný personál.
,,,"Footballer Stuart Parker plays for KV Mechelen and is the manager of A.F.C. Blackpool whose ground is in Blackpool, where the leader is the Conservative Party (UK)."
,,,"Fotbalista Stuart Parker hraje za KV Mechelen a je manažerem A.F.C. Blackpool, jehož působiště je v Blackpoolu, kde je lídrem Konzervativní strana (UK)."
,,,Blackpool based club AFC Blackpool is managed by Stuart Parker who is part of the KV Mechelen club. The town is led by the Conservative Party UK.
,,,"Klub založený v Blackpoolu AFC Blackpool řídí Stuart Parker, který je součástí klubu KV Mechelen. Město vede Konzervativní strana UK."
,,,The apoapsis for (15788) 1993 SB is 7715100000.0 (kilometres).
,,,Apoapse pro (15788) 1993 SB je 7715100000.0 (km).
,,,15788 1993 SB has an apoapsis of 7715100000 kilometres.
,,,15788 1993 SB má apoapsis 7715100000 kilometrů.
,,,Bakso is a traditional dish found in the whole of Indonesia and is popular in neighbouring Southeast Asian countries too. Jakarta is the capital of Indonesia and the leader is Jusuf Kalla.
,,,"Bakso je tradiční pokrm, který se vyskytuje v celé Indonésii a je populární i v sousedních zemích jihovýchodní Asie. Jakarta je hlavním městem Indonésie a lídrem je Jusuf Kalla."
,,,"Bakso is an Indonesian dish, popular all over the country and also a favourite in other Southeastern Asian nations. Indonesia's leader is Jusuf Kalla and the capital city is Jakarta."
,,,"Bakso je indonéské jídlo, oblíbené po celé zemi a oblíbené i v dalších státech jihovýchodní Asie. Lídrem Indonésie je Jusuf Kalla a hlavním městem je Jakarta."
,,,"Adam Holloway was in the Grenadier Guards, in the military, he began his career on 5th May 2005 and fought in the Gulf War. John Major was a commander in the Gulf War."
,,,"Adam Holloway byl u granátníků, v armádě, svou kariéru zahájil 5. května 2005 a bojoval ve válce v Perském zálivu. John Major byl velitelem ve válce v Perském zálivu."
,,,"Adam Holloway began his career on May 5th 2005, served in the Grenadier Guards, and was involved in Gulf War battles. John Major was a commander during the Gulf War."
,,,"Adam Holloway začal svou kariéru 5. května 2005, sloužil u granátníků a účastnil se bojů války v Perském zálivu. John Major byl velitelem během války v Perském zálivu."
,,,"Adam Holloway, who served in the Grenadier Guards and was involved in the Gulf War, began his political career on 5th May 2005. John Major was a commander in the Gulf War."
,,,"Adam Holloway, který sloužil u granátníků a účastnil se války v Perském zálivu, zahájil svou politickou kariéru 5. května 2005. John Major byl velitelem ve válce v Perském zálivu."
,,,The leader of Blackpool is the Conservative Party (UK).
,,,Vůdcem Blackpoolu je Konzervativní strana (UK).
,,,"Born in Dothan, Alabama, in 1981, and originally a solo singer, Allen Forrest plays pop music."
,,,Narodil se v Dothanu v Alabamě v roce 1981 a původně byl sólovým zpěvákem.
,,,"Pop artist, Allen Forrest, originally a solo singer, was born in Dothan, Alabama, in 1981."
,,,"Popový umělec Allen Forrest, původně sólový zpěvák, se narodil v Dothanu v Alabamě v roce 1981."
,,,"Allen Forrest was born in 1981, in Dothan, Alabama. Originally a solo singer, Allen Forrest plays pop music."
,,,"Allen Forrest se narodil v roce 1981 v Dothanu v Alabamě. Původně sólový zpěvák, Allen Forrest hraje pop music."
,,,"Salem is the capital of Oregon, the state where Albany is located, in the United States. The country where Americans live and where African Americans are one of the ethnic groups."
,,,"Salem je hlavní město Oregonu, státu, kde se nachází Albany, ve Spojených státech. Země, kde žijí Američané a kde jsou Afroameričané jednou z etnických skupin."
,,,"Albany is a city in Oregon, the capital of which is Salem. Albany, Oregon is located within the United States, where the inhabitants are called Americans, and where African Americans are one of the ethnic groups."
,,,"Albany je město v Oregonu, jehož hlavním městem je Salem. Albany v Oregonu se nachází ve Spojených státech, kde se jeho obyvatelům říká Američané a kde jsou Afroameričané jednou z etnických skupin."
,,,T S Thakur is the leader of India; also the location of Amdavad ni Gufa.
,,,T S Thakur je vůdce Indie; také umístění Amdavad ni Gufa.